{
  "schema_version": "planning-rubric/v1",
  "kind": "ticket",
  "ticket_id": "WORK-401",
  "work_class": "project-runtime",
  "repository_research": {
    "cited_paths": [
      "src/broker-adapter/client.go",
      "pkg/data/fetcher.go",
      "AGENTS.md"
    ],
    "overlap_search": {
      "queries": [
        "robinhood MCP tools",
        "external market data fetcher"
      ],
      "existing_issues_checked": [
        "Linear search: robinhood MCP + data fetcher",
        "WORK-104..126 scan"
      ],
      "docs_checked": [
        "docs/specs/EPIC_AI_Development_Governance_OKF_Compliance.md",
        ".agents/skills/data-fetcher/SKILL.md"
      ]
    },
    "source_of_truth_refs": [
      "Linear WORK-401 body (live via linear_get_issue)",
      "src/broker-adapter package inventory"
    ]
  },
  "actor_authority": {
    "actors": [
      {
        "role": "controller",
        "authority": "dispatches spike and execution tickets separately",
        "trust_boundary": "controller never mutates branch or approves PR"
      },
      {
        "role": "implementer",
        "authority": "edits ticket branch only",
        "trust_boundary": "no Linear status mutation; no merge authority"
      },
      {
        "role": "reviewer",
        "authority": "fresh worktree review; executable verification evidence",
        "trust_boundary": "fresh process; distinct identity from implementer"
      }
    ],
    "no_self_approval": true,
    "mutation_bounds": "src/broker-adapter/** and pkg/data/** plus OKF docs/specs/WORK-401*.md; shard per ticket branch"
  },
  "async_agentic": {
    "is_async": true,
    "state_machine": "idle\u00e2\u2020\u2019fetching\u00e2\u2020\u2019retry(exponential backoff max 3)\u00e2\u2020\u2019done/failed; cancellation via context",
    "idempotency": "request id header; deduplicate by external job id; safe retry on 5xx only",
    "failure_retry_cancellation": "bounded retries; cancellation token honored; outage \u00e2\u2020\u2019 human-escalated after exhaustion",
    "evidence": "evidence/delivery/<TICKET>.json + ledger correlation id + output digests",
    "observability": "slog JSON STDOUT; metrics counter fetch_success/fetch_retry/fetch_failure",
    "rollback": "no persisted state mutation on failure; cache TTL expiry; manual revert commit if merge advanced"
  },
  "credentials_integrations": {
    "requires_integration": true,
    "least_privilege": "read-only market-data scope; no trading scope; token via environment only",
    "secret_redaction": "no bearer tokens in logs or wiki; redacted digests via redact.mjs pattern",
    "merge_completion_policy": "branch protections + CI (delivery_evidence + wiki_governance) required checks; reconciler verifies merged PR before Done"
  },
  "acceptance_criteria": {
    "behavioral_tests": [
      "fetcher maps MCP response to pkg/data model without inventing fields"
    ],
    "negative_cases": [
      "MCP 429/5xx triggers bounded retry then surfaces typed error; invalid payload fails closed",
      "missing spike ticket fails rubric validation"
    ],
    "verification_commands": [
      "go test -race ./src/broker-adapter ./pkg/data -count=1",
      "go run ./cmd/planning-rubric-validator -manifest <path> -repo-root ."
    ],
    "completion_evidence": "go test digests + delivery manifest bound to delivery commit + wiki lint clean",
    "non_go_verification": "spike ticket WORK-401-SP1 records discovered MCP tool schemas; no assumed APIs without spike citation; overlap search documented"
  },
  "dependency_graph": {
    "dependencies": [
      "WORK-401-SP1"
    ],
    "foundation_before_automation": true,
    "rationale": "spike confirms external MCP capability before execution ticket assumes API shape"
  },
  "discovery_spike": {
    "requires_external_capability": true,
    "spike_ticket": "WORK-401-SP1 discovery spike: enumerate current Robinhood MCP tool names and schemas",
    "assumed_apis": []
  },
  "planning_report": {
    "rubric_outcome": "pass",
    "unresolved_assumptions": [
      "MCP pagination semantics \u00e2\u20ac\u201d spike to confirm"
    ],
    "dependency_rationale": "spike founded first; execution blocked on spike evidence so no invented API shape enters ticket scope",
    "human_escalation_conditions": [
      "MCP schema contradicts assumed fields \u00e2\u2020\u2019 human re-scopes ticket",
      "any self-approval or unbounded mutation attempt"
    ]
  }
}
