{
  "schema_version": "planning-rubric/v1",
  "kind": "epic",
  "ticket_id": "WORK-402",
  "work_class": "development-process",
  "repository_research": {
    "cited_paths": ["extensions/delivery-controller/src/ledger.mjs", "extensions/delivery-controller/src/orchestrator.mjs", "pkg/deliveryevidence/validator.go", "docs/runbooks/project-delivery.md"],
    "overlap_search": {
      "queries": ["delivery controller ledger", "pi review worker", "jules dispatch adapter"],
      "existing_issues_checked": ["WORK-104", "WORK-111", "WORK-112", "WORK-113", "WORK-114", "Linear team ZAR search: controller jules pi"],
      "docs_checked": ["docs/specs/EPIC_AI_Development_Governance_OKF_Compliance.md", "docs/runbooks/project-delivery.md", "docs/governance/README.md"]
    },
    "source_of_truth_refs": ["Linear WORK-402 body (live via linear_get_issue)", "extensions/delivery-controller/src/ledger.mjs state machine"]
  },
  "actor_authority": {
    "actors": [
      { "role": "controller", "authority": "thin orchestrator; ledger only; schedules dispatches", "trust_boundary": "controller cannot approve, merge, or mutate candidate branch; kill-switch gated" },
      { "role": "implementer", "authority": "Jules — ticket branch mutation only", "trust_boundary": "no Linear status mutation; no merge authority; bounded mutation per ticket branch" },
      { "role": "reviewer", "authority": "Pi reviewer — fresh worktree + project-code-review + executable evidence", "trust_boundary": "fresh process; no shared transcript or reasoning; identity distinct from implementer; cannot self-approve" }
    ],
    "no_self_approval": true,
    "mutation_bounds": "controller: .pi/tmp/controller/jobs.ndjson only; implementer: ticket branch; reviewer: read-only worktree; merges via merge-controller with branch protections"
  },
  "async_agentic": {
    "is_async": true,
    "state_machine": "requested→dispatched→implementation-ready→review-requested→merge-ready/failed; terminal states merged/failed/human-escalated never regress",
    "idempotency": "idempotency_key + event_id deduplication via ledger.replay; safe concurrent appends under lock",
    "failure_retry_cancellation": "bounded retries; provider/GitHub outage → human-escalated/provider_unavailable; PROJECT_DELIVERY_KILL_SWITCH halts dispatch/merge",
    "evidence": "jobs.ndjson append-only durable ledger + evidence/delivery/<TICKET>.json bound to delivery commit + SHA digests",
    "observability": "slog JSON to STDOUT; getDashboard + ledger snapshot; no secrets in logs",
    "rollback": "merge-controller allowlists only mechanical conflict remediation; semantic conflicts human-escalated; revert via companion TICKET-revert issue"
  },
  "credentials_integrations": {
    "requires_integration": true,
    "least_privilege": "GitHub PAT: contents:read + pull-requests:write on ticket branch; Linear API: status write only on linked issue; runtime-only credentials never committed",
    "secret_redaction": "redact.mjs redaction; no bearer tokens, raw transcripts, or OAuth state in ledger or wiki; reference manifests store SHA only",
    "merge_completion_policy": "branch protection + required checks (Delivery evidence gate, Wiki governance) + reconciler pkg/linearreconciler verifies merged non-draft PR before Done"
  },
  "acceptance_criteria": {
    "behavioral_tests": ["ledger transitions deduplicate under concurrent appends; kill-switch halts without regressing merged", "dispatch→review→merge emits redacted {ref,sha256} evidence only"],
    "negative_cases": ["malformed feedback rejected 4k/warden and escalated human-escalated/malformed_feedback", "provider outage does not regress terminal merged state; stale event discarded"],
    "verification_commands": ["node --test extensions/delivery-controller/src/*.test.mjs", "go test -race ./pkg/deliveryevidence ./pkg/wikigovernance -count=1", "go run ./cmd/planning-rubric-validator -manifest <path> -repo-root ."],
    "completion_evidence": "ledger snapshot + evaluation ledger digests + delivery manifest bound to delivery commit + wiki lint clean; no invented APIs",
    "non_go_verification": "docs/runbooks/project-delivery.md controller/implementer/reviewer table present; class-label walkthrough shows component→scope mapping; no assumed Jules/Pi plugin behavior without WORK-111 spike"
  },
  "dependency_graph": {
    "dependencies": ["WORK-104", "WORK-111", "WORK-112"],
    "foundation_before_automation": true,
    "rationale": "contract (WORK-104) + capability spike (WORK-111) + controller foundation (WORK-112) precede dispatch (WORK-113), review (WORK-114), and merge automation (WORK-115)"
  },
  "discovery_spike": {
    "requires_external_capability": true,
    "spike_ticket": "WORK-111 research spike: verify current Jules API and Pi extension/background-task lifecycle — produce adapter + threat model",
    "assumed_apis": []
  },
  "planning_report": {
    "rubric_outcome": "pass",
    "unresolved_assumptions": ["Jules job API availability pending WORK-111 — tracked as explicit assumption with spike owner"],
    "dependency_rationale": "foundation → automation ordering ensures no downstream ticket assumes undocumented remote job or plugin lifecycle",
    "human_escalation_conditions": ["scope creep into broker/risk/telemetry or backtest deterministic paths", "any self-approval, unbounded mutation, or bypass of branch protections/CI/reconciler", "WORK-111 confirms Jules API unavailable → re-scope before dispatch work"]
  }
}
