{
  "schema_version": "planning-rubric/v1",
  "kind": "ticket",
  "ticket_id": "WORK-400",
  "work_class": "project-runtime",
  "repository_research": {
    "cited_paths": ["src/domain-risk/guard.go", "src/domain-risk/guard_test.go", "AGENTS.md"],
    "overlap_search": {
      "queries": ["risk guard DetectAnomaly", "SignalBuy downgrade"],
      "existing_issues_checked": ["WORK-108", "Linear search: risk guard"],
      "docs_checked": ["docs/specs/EPIC_AI_Development_Governance_OKF_Compliance.md", "AGENTS.md section 5"]
    },
    "source_of_truth_refs": ["Linear WORK-400 body", "AGENTS.md section 5 anomaly guard contract"]
  },
  "actor_authority": {
    "actors": [
      { "role": "controller", "authority": "none — single-ticket synchronous change; no dispatch", "trust_boundary": "controller not involved" },
      { "role": "implementer", "authority": "edits ticket branch zkrausman/work-400-* only", "trust_boundary": "no Linear status mutation; no merge authority" },
      { "role": "reviewer", "authority": "fresh worktree; project-code-review; independent verdict", "trust_boundary": "no shared transcript; reviewer identity distinct from implementer" }
    ],
    "no_self_approval": true,
    "mutation_bounds": "src/domain-risk/** and docs/specs/WORK-400.md only; branch zkrausman/work-400-slate"
  },
  "async_agentic": {
    "is_async": false,
    "state_machine": "not_applicable — synchronous Go change",
    "idempotency": "not_applicable",
    "failure_retry_cancellation": "not_applicable",
    "evidence": "not_applicable",
    "observability": "not_applicable",
    "rollback": "not_applicable"
  },
  "credentials_integrations": {
    "requires_integration": false,
    "least_privilege": "not_applicable — no external integration",
    "secret_redaction": "no secrets; no credentials in code or logs",
    "merge_completion_policy": "branch protection + CI required checks; reconciler verifies merged PR before Done"
  },
  "acceptance_criteria": {
    "behavioral_tests": ["DetectAnomaly excludes tested point from rolling window; downgrades SignalBuy only"],
    "negative_cases": ["SignalSell not downgraded when drawdown exceeds threshold", "guard rejects out-of-window input without panic"],
    "verification_commands": ["go test -race ./src/domain-risk -count=1", "go vet ./src/domain-risk/..."],
    "completion_evidence": "go test output hashes in delivery manifest; OKF updated; wiki source/page IDs recorded",
    "non_go_verification": "docs/specs/WORK-400.md lists cited paths and overlap search; no invented APIs or issue links; duplicate/overlap guidance followed"
  },
  "dependency_graph": {
    "dependencies": [],
    "foundation_before_automation": true,
    "rationale": "standalone runtime change; no prerequisites beyond master"
  },
  "discovery_spike": {
    "requires_external_capability": false,
    "spike_ticket": "",
    "assumed_apis": []
  },
  "planning_report": {
    "rubric_outcome": "pass",
    "unresolved_assumptions": [],
    "dependency_rationale": "no dependencies; single-ticket change lands directly on master via governed PR",
    "human_escalation_conditions": ["scope expands beyond src/domain-risk into broker/telemetry paths", "any attempt to invent MCP or broker APIs"]
  }
}
